instance_id,complexity_percentage,category,solvability_percentage,reasoning
sphinx-doc__sphinx-7440,20,easy,85,"The fix touches a single file with only two small changes: it stops lower-casing glossary term identifiers and removes the lowercase flag from the corresponding XRefRole. No new logic or algorithms are introduced; the solution is essentially deleting two occurrences of case-normalization. The problem statement clearly points to the root cause (duplicate glossary entries differing only in case), making it straightforward to reason that the unwanted lower-casing is the culprit. An AI system that scans for where glossary terms are registered or compared could quickly locate the `.lower()` call and the `lowercase=True` parameter, so the likelihood of generating the correct patch is high. Minimal domain knowledge is required beyond understanding that preserving case sensitivity resolves the duplication warning."
sphinx-doc__sphinx-7454,30,medium,80,"The actual code change is very small (one function, ~5 added/modified lines in a single file) and does not involve any intricate algorithmic work. However, correctly fixing the bug requires awareness of Sphinx’s Python-domain cross-reference types (""class"" vs ""obj"") and how autodoc_typehints renders annotations, which goes beyond pure pattern matching. An engineer (or an AI) must trace why the link for `None` is missing, locate the helper that converts annotation strings to xrefs, and realize that `None` must be treated as a plain object constant, not a class. This domain insight bumps the task out of the “easy” bucket into “medium”. Because the problem statement is clear, the scope is tiny, and the fix is essentially a conditional switch on one string, an automated system with modest knowledge of Sphinx internals has a high likelihood of producing the correct patch, hence a solvability estimate of roughly 80%."
sphinx-doc__sphinx-7462,20,easy,85,"The patch touches two files with a total of roughly a dozen added lines and minimal control-flow changes. The bug is a straightforward edge-case: the existing tuple-unparse logic assumes at least one element and performs a final pop(), causing an IndexError on empty tuples. The fix simply checks for the presence of elements and handles the empty case by returning the literal ""()"". No algorithms or deep architectural knowledge are involved; the unparser structure is clear and the stack trace pinpoints the failing line. An AI system only needs to recognize the empty-tuple condition and add a guard, which is a common pattern. Therefore, complexity is low, the task is categorized as easy, and the likelihood of an AI generating the correct patch from the description and error message is high."
sphinx-doc__sphinx-7590,65,hard,35,"The patch spans three modules (cfamily.py, c.py, cpp.py) and introduces new regular expressions, extends existing literal-parsing logic, creates a brand-new ASTUserDefinedLiteral node, alters signature rendering, and adds a new description mode (""udl"").  Supporting C++ user-defined literals requires knowledge of the C++ grammar (distinguishing between numeric/character suffixes and a true UDL, handling word boundaries, float/int suffixes, name lookup rules, ID mangling, etc.) as well as the internal architecture of Sphinx’s C/C++ domain: its tokenizer, recursive-descent parser, AST hierarchy, symbol table, and the HTML rendering pipeline.  The changes must remain compatible with all other literal kinds and not break cross-referencing, so subtle interactions need to be considered.  Although the problem statement is clear (“add UDL support”), the concrete implementation details are not specified; an AI would have to discover where in the parser to hook, craft correct regexes, manage suffix vs UDL ambiguity, modify AST IDs, and update the rendering path—all non-trivial tasks.  Consequently, the task is complex (≈65 %) and falls into the “hard” category.  Because of the open-ended nature, the absence of guiding tests, and the need for deep domain expertise, the likelihood that an AI could autonomously synthesize the exact solution is modest (≈35 %)."
sphinx-doc__sphinx-7748,45,medium,60,"The change is confined to a single file but touches several connected methods that cooperate inside Sphinx’s autodoc extension. Roughly 70 lines are added/modified, introducing new instance variables, altering control flow, handling multiline signatures, and concatenating multiple discovered signatures. The algorithmic work is straightforward looping and string/regex handling—no advanced data structures—but the developer must understand Sphinx’s documenter life-cycle, the existing signature-extraction regex, and how return values propagate to the final rendered signature list. That domain understanding pushes the task above a simple bug-fix but below a large architectural refactor. 

From an AI’s perspective, the requirement (“support all overloaded signatures appearing at the top of the docstring”) is explicit enough to reason about; the surrounding code provides clear hooks (_find_signature, format_signature). However, edge-cases such as backslash-continued lines and ensuring only relevant names are matched add subtlety. Without exhaustive tests an AI might miss those nuances, yet the solution space is limited and boilerplate heavy, so a competent model could reach a correct patch with some probability. Hence the solvability estimate is moderate-high (≈60%), while the overall complexity remains in the middle range."
sphinx-doc__sphinx-7757,40,medium,55,"The patch modifies a single utility file, touching roughly 20 lines to correctly align default values with positional-only parameters introduced in Python 3.8. The logic added is limited in scope but requires understanding of Python’s AST structure, inspect.Parameter kinds, and the way Sphinx builds function signatures. This puts it above trivial fixes but well below large-scale refactors, leading to a moderate complexity score.

Key challenges include: 1) realising that positional-only arguments change the offset between the defaults tuple and the argument list, 2) recreating an explicit list of defaults padded with Parameter.empty to keep indices consistent, and 3) handling both pos-only and regular positional parameters while preserving annotations.

Because the bug report is precise, provides a minimal reproducer, and narrows the issue to signature rendering, an experienced developer (or an AI with code search) can localise the faulty logic quickly. However, crafting the correct index arithmetic and ensuring no regressions demands careful thinking, so the solvability, while better than chance, is not near-certain."
sphinx-doc__sphinx-7889,15,easy,85,"Only one small method needed editing. The bug stemmed from assuming the __getitem__ key is always a string; generic-type parameters can be TypeVar objects, causing string concatenation to fail. Fixing it just required (1) widening the type annotation to Any and (2) converting the key to str before passing it on. No new algorithms or architectural knowledge is necessary—just awareness of Python's typing module and Sphinx’s mock helper. An AI system with access to the traceback and a minimal understanding of the code flow could easily infer that the key should be str-ified, hence high solvability. The change touches one file and a few lines, so overall complexity is low."
sphinx-doc__sphinx-7910,20,easy,85,"The fix touches a single file and adds only two small edits: importing sphinx.util.inspect and replacing obj.__globals__ with inspect.unwrap(obj).__globals__. No new algorithms or cross-module interactions are introduced. While one must understand Python decorators and the need to unwrap a wrapped function to access the original globals, this is routine introspection knowledge, not deep architectural work. Because the problem statement already pinpoints the offending line and explains the exact issue (decorated __init__ lacks the proper globals), an AI system could infer that inspect.unwrap is the correct remedy with high likelihood. Thus the change is simple, the category is easy, and the chance of automated generation is high, though not perfect because it still requires awareness of the inspect.unwrap utility."
sphinx-doc__sphinx-7985,35,medium,70,"The fix touches a single module (linkcheck builder) and adds ~15 lines that introduce a simple regular-expression test for URI schemes and a filesystem existence check for relative links. No intricate algorithm or cross-module refactoring is involved; the change is essentially a conditional branch with path.exists logic. Understanding Sphinx’s build context and link classification rules is helpful but not deep domain expertise. Because the desired behaviour (treat local paths as working/broken) is clearly stated, an AI with access to the code can infer that it needs to detect the absence of an http/https scheme and verify the file on disk. The main challenge lies in distinguishing unsupported schemes (e.g., ftp) from true local paths and in keeping existing ignore logic intact, which is moderate complexity. Given the clarity of the requirement and the small, isolated change, an automated system stands a good chance of producing a correct patch, though edge cases (Windows paths, odd schemes) add some uncertainty."
sphinx-doc__sphinx-8035,40,medium,55,"The change touches a single core file (~40 modified lines) and introduces a small helper, type-changes for option parsing, and some conditional logic updates. It requires understanding how Sphinx autodoc merges member options, how the ALL sentinel is treated, and how the filtering loop decides whether to keep a member. No new algorithms are added; the work is mainly plumbing existing mechanisms to a new option value type and ensuring backward compatibility. That puts it above a trivial fix but below a large architectural change.

An AI must locate where the private-member option is declared, swap its validator from bool to list, integrate the list with the main members list, and adjust the keep/skip logic. The overall behaviour is well described in the feature request, but correctly updating every decision point (merging, filtering, inheritance, deprecation warnings) needs moderate codebase familiarity and careful reasoning to avoid regressions. Given Sphinx’s extensive test suite, feedback cycles would help, so the probability of a competent AI solving it is slightly better than even but far from certain."
sphinx-doc__sphinx-8056,30,medium,70,"The fix touches only one file and adds fewer than 15 lines, so the change set itself is small. However, it requires understanding how Napoleon parses docstring fields, how the parser’s `_consume_fields` function is used in different contexts, and how the `napoleon_use_param` configuration influences rendering. The core algorithmic change—splitting a comma-separated parameter list and emitting individual entries—is straightforward string processing, but knowing exactly where to insert this logic and guarding it behind a flag (`multiple=True`) demands moderate familiarity with the codebase. An AI system supplied with the bug report and code context could likely infer that splitting on commas is the solution, giving a relatively high solvability score. Nonetheless, the need to propagate the new parameter through call sites and to avoid breaking other sections elevates the task above “easy,” placing it in the medium category."
sphinx-doc__sphinx-8120,30,medium,70,"The change affects two files with a total of roughly ten new/modified lines, no new classes or algorithms, and only reorders the search path for localization files while adjusting a type annotation. Understanding the fix requires some knowledge of how Sphinx resolves message catalogs (project-specific vs. built-in) and awareness that earlier directories in the list take precedence. This is more involved than a typo but far from a large architectural refactor, placing it in the lower-middle complexity range. An AI given the bug report could infer that the custom catalog is being shadowed and that the search priority must be adjusted, making the task reasonably achievable, especially because the bug description explicitly points to where the user’s .mo file sits and that it is ignored. Therefore, the likelihood an automated system can generate the correct patch is fairly high, though not guaranteed, leading to a 70 % solvability estimate."
sphinx-doc__sphinx-8265,35,medium,65,"The bug manifests as incorrectly rendered default argument values (tuples lose their surrounding parentheses). The fix touches only one file (sphinx/pycode/ast.py) and changes ~20 LOC, mainly enclosing tuple output in parentheses and adding special-case logic for tuple slices. While knowledge of Python’s AST and Sphinx’s unparser is needed, the algorithmic work is straightforward string formatting—no deep refactor or multi-module impact. An experienced developer or an AI that inspects the existing visit_Tuple implementation could infer that the missing parentheses cause the observed output. Adding a helper for tuple slices is a small extension of the same idea. Therefore the change is moderately complex, falls into the ""medium"" category, and is reasonably discoverable from the bug description, giving it a 65 % likelihood of being automatically generated correctly."
sphinx-doc__sphinx-8269,10,easy,90,"The change consists of a single-line addition in one file: invoking response.raise_for_status() immediately after performing the HTTP GET. No algorithms or cross-module interactions are affected, and the intent is clearly described in the bug report (return HTTP error instead of anchor-not-found). Implementing this fix requires only basic familiarity with the requests library and the existing code flow; no deep Sphinx internals are touched. Given the clarity of the problem statement and the minimal patch size, an AI system should reliably infer the correct solution, yielding a high solvability score and low complexity classification."
sphinx-doc__sphinx-8459,15,easy,85,"The change modifies a single line in one file, switching a call from inspect.signature(obj) to inspect.signature(obj, type_aliases=app.config.autodoc_type_aliases). No new algorithms or architectural changes are introduced; it is a straightforward parameter-passing fix. Understanding the issue mainly requires awareness that Sphinx wraps inspect.signature to accept a type_aliases argument and that this argument must be supplied when autodoc_type_aliases is configured. The problem statement is clear about the undesired behavior, and the location of the fault is easy to trace by searching where signatures are generated. Given the focused scope, minimal code delta, and explicit symptom, an AI system has a high likelihood of proposing the correct adjustment once it inspects the function call, hence the high solvability percentage."
sphinx-doc__sphinx-8475,15,easy,90,"Only two small code edits in a single file: import an additional exception class and expand an existing except clause to also catch TooManyRedirects. No algorithmic changes, no interaction with other modules. The problem statement explicitly explains the symptom and desired behaviour, practically describing the required patch, so an AI can map it to the code with simple pattern matching. Minimal domain knowledge is needed (knowing requests library exception hierarchy). Therefore complexity is low and likelihood of an AI producing the correct fix is very high."
sphinx-doc__sphinx-8548,45,medium,40,"The change spans two files and roughly 40 lines, introducing a new traversal over the MRO and per-class ModuleAnalyzer creation. It requires understanding how Sphinx autodoc stores attribute docstrings, how ModuleAnalyzer.attr_docs is keyed, and why inherited attributes were previously skipped. The algorithmic work is straightforward list/dict handling, but domain knowledge of Sphinx internals and Python introspection is needed, pushing it above a simple patch but well below an architectural overhaul. From the brief problem statement an AI must deduce that attribute docs for each base class need to be searched and integrate that into get_class_members without breaking existing behaviour; this is non-trivial, especially without explicit tests, so likelihood of an AI producing the exact fix is moderate to low."
sphinx-doc__sphinx-8551,30,medium,45,"The patch touches two files and adds only a handful of lines, so the code-change footprint is small. However, the bug involves Sphinx’s internal cross-reference resolution, which requires understanding how reference nodes store contextual attributes (py:module, py:class) and how docfield helpers call make_xref. An implementer must know that explicit roles already set these attributes and that passing the env plus copying ref_context into the new reference node will align the behaviour. This is domain-specific knowledge but not algorithmically complex. An AI could discover the missing attributes by diff-ing behaviour between explicit and implicit xrefs or by reading surrounding code, but the solution is not a simple pattern substitute; it needs insight into Sphinx’s resolution logic. Therefore complexity is moderate (≈30%), the task category is ""medium"", and the likelihood an AI produces the exact fix from the description without additional hints is under 50% but still plausible (≈45%)."
sphinx-doc__sphinx-8593,40,medium,35,"The change touches two files with roughly 60 new lines and some removals. It introduces a new helper method to gather module members while preserving per-member docstrings so that the "":meta public:"" field can be interpreted. No sophisticated algorithms are added, but understanding Sphinx’s autodoc internals (ModuleDocumenter, ObjectMember, analyzer.attr_docs interaction, underscore-prefixed name filtering, etc.) is required. The developer must notice that the old get_module_members() discarded docstrings and therefore meta information, devise a replacement that keeps this data, and update call sites while deprecating the old utility. This goes beyond a trivial fix yet is still contained and conceptually straightforward, placing the complexity around 40% and the task in the ""medium"" category. For an AI, inferring this root cause from the brief bug report without explicit tests or deep documentation is challenging; it must navigate multiple layers of Sphinx internals, so the likelihood of producing the exact patch is relatively low, estimated at 35%."
sphinx-doc__sphinx-8595,10,easy,80,"The patch is a one-line logical change within a single function. The issue is that the old condition conflated a missing __all__ attribute (None) with an explicitly empty list. Changing the check to `is None` distinguishes the two cases and fulfills the stated expectation. No algorithms or multi-module interactions are involved; only basic Python truthiness semantics. The problem statement is explicit, shows a minimal reproduction, and makes the required behavior obvious. An AI needs only recognize the difference between None and an empty list, making the task highly solvable with minimal codebase understanding. Hence low complexity, easy category, and high likelihood of automatic repair success."
sphinx-doc__sphinx-8621,18,easy,72,"The fix touches a single file and alters just one regular-expression pattern. No additional logic, state management, or multi-module interaction is involved, so the intrinsic code complexity is low. The only knowledge required is understanding how look-behind and look-ahead assertions in regex can prevent matching separators that appear at the beginning or end of the string; this is standard regex fluency rather than deep architectural insight. Generating the correct patch is therefore largely pattern-matching: recognize that the existing pattern splits on every occurrence of '-', '+', or '^', and modify it so it only splits when those characters are surrounded by other characters. An AI supplied with failing test cases (or the descriptive examples in the bug report) could deduce that adding `(?<=.)` and `(?=.)` or equivalent boundaries solves the issue, making the task reasonably achievable. Because the requirements are explicit and the search space of correct regexes is small, the solvability is above average even without extensive context, but it still requires some trial-and-error, so it is not near 100%."
sphinx-doc__sphinx-8638,20,easy,65,"The fix touches a single file with a one-line change that merely removes the ""rolename='obj'"" argument from the PyTypedField definition for variables. There are no new algorithms, data structures, or cross-module interactions introduced, so the inherent code complexity is low.      

What makes the bug tricky is mostly domain knowledge: understanding that Sphinx treats any field with a rolename as an internal reference target, causing automatic cross-linking. Identifying that this single flag is responsible for the incorrect links requires familiarity with Sphinx’s autodoc/linking mechanics, but once the cause is known, the modification itself is straightforward.      

Because the patch is so small and isolated, an automated system that can correlate “variables are being auto-linked” with “field definition sets rolename” has a reasonable chance of producing the same fix, even by simple pattern search in the domain code. However, some conceptual insight into Sphinx internals is still necessary, so the solvability is not near certain but above average."
sphinx-doc__sphinx-8721,12,easy,88,"The fix touches a single function in one file and adds two straightforward guard clauses totaling four lines of code. No intricate algorithm or deep architectural knowledge is required—just awareness of builder names and an existing config flag. The problem statement clearly describes the undesired behavior and names the relevant configuration option, so an AI can locate the collect_pages hook and insert the missing checks with minimal exploration. Therefore, technical complexity is low, and the likelihood an AI system could generate the correct solution is high."
sphinx-doc__sphinx-9229,40,medium,55,"The change touches only one file and about 25-30 lines, so the code volume is modest, but it requires understanding how Sphinx autodoc decides whether to show the docstring for attributes that are actually type aliases. The developer must know about the `doc_as_attr` flag, how variable comments are stored in `ModuleAnalyzer.attr_docs`, and how `add_content` injects the default ""alias of …"" text. The solution entails introducing a helper (`get_variable_comment`) and using its result in two places to suppress the default behaviour only when an explicit comment exists. This demands some insight into Sphinx internals but no complex algorithm or large-scale refactor, hence a medium difficulty (~40% complexity). 

From an automated-repair standpoint, the observable bug (“some alias docstrings disappear”) provides a clear hint, and the required patch is localized and pattern-driven once the relevant property (`doc_as_attr`) is discovered. An advanced AI with access to the codebase could plausibly trace the early return that hides the docstring and adjust it, giving a moderate chance of success (~55% solvability)."
sphinx-doc__sphinx-9230,15,easy,75,"Only a single line in one file is modified: the call to string.split is replaced with rsplit. This is a straightforward bug fix once the root cause (splitting on the first rather than the last whitespace) is understood. No additional algorithms or structural changes are required, and no cross-module interactions are affected. The problem statement clearly describes the incorrect rendering and implicitly points to the need to parse the parameter name correctly, making the scope narrow and well-defined. An AI system that can trace the parsing logic and notice the improper split direction would likely arrive at this solution, leading to a fairly high solvability score. Minimal domain knowledge of Sphinx internals is needed; general string-processing insight is sufficient."
sphinx-doc__sphinx-9258,15,easy,70,"The change touches a single file and alters only one line by extending an existing regular-expression pattern so that it treats the vertical bar (|) as an additional separator when splitting a type string. No new logic, data structures, or interactions across modules are introduced. The task mainly requires identifying where Sphinx currently tokenises type annotations and adding an obvious alternate delimiter. This is straightforward once the correct location is found and only basic regex knowledge is necessary.

While locating the precise regex inside the large Sphinx codebase demands some codebase familiarity, it can be found quickly by searching for the existing delimiters (e.g. ', or ') mentioned in the problem statement. Because the adjustment is purely additive and does not risk breaking other behaviour, the solution space is narrow and an AI equipped with code-search heuristics is likely to propose the same patch. Lack of explicit tests lowers confidence slightly, but the scope is so contained that the likelihood of an AI generating the right fix remains high."
