instance_id,complexity_percentage,category,solvability_percentage,reasoning
astropy__astropy-12907,-1,error,-1,Failed to parse response
astropy__astropy-13033,15,easy,85,"The change is confined to a single method in one file (TimeSeries._check_required_columns). It only adds a small helper to format error-message arguments and revises the ValueError text. No algorithms or data structures are altered; the functional behaviour of the class remains identical except for clearer messaging. Understanding the fix requires minimal domain knowledge (just that TimeSeries has a list of required columns). An AI reading the misleading message and the if-block that constructs it could quickly infer that the comparison should include all required columns, not just the first. Crafting the helper to print either a scalar or list is straightforward string manipulation. Because the scope is narrow, the logic is simple, and no interaction with other parts of the codebase is needed, the task is highly solvable by automated tools."
astropy__astropy-13236,20,easy,85,"The patch touches a single file and consists solely of deleting a short conditional block (≈7 lines) that auto-converts structured NumPy arrays into an NdarrayMixin when adding them to an Astropy Table. No new logic, algorithms, or cross-module interactions are introduced. Understanding that this behavior change is desired requires some knowledge of Astropy mixins, but the mechanical change—removing the specified code block—is straightforward. Because the problem statement pinpoints the exact code to be altered and the solution is a simple deletion, an AI system could reliably generate the correct patch with minimal reasoning, leading to a high solvability score despite the need for minor domain context."
astropy__astropy-13398,70,hard,35,"The patch touches five files, introduces an entirely new transformation module, adds a new frame attribute, updates multiple existing transformation functions, and implements non-trivial mathematics for Earth-centred/observed frame conversions and atmospheric refraction. Correctly wiring these transforms into Astropy’s FrameTransformGraph demands familiarity with the library’s internal architecture and with celestial-mechanics conventions (left-handed vs right-handed frames, sidereal time, ERFA refraction coefficients, topocentric vs geocentric aberration). Although the issue description contains a prototype, the final solution is significantly richer: it handles refraction, location propagation, time synchronisation, and edge-case safeguards (e.g., numerical limits for sin/cos altitude). This breadth and the specialised domain knowledge push complexity to the “hard” range. For an AI starting only from the problem statement, reproducing all these nuanced, domain-specific details—especially the correct ERFA calls and matrix orientations—would be challenging, hence a moderate-low solvability estimate."
astropy__astropy-13453,18,easy,87,"The fix consists of adding two straightforward lines to the HTML writer: storing the column objects on the Data object and invoking the helper that applies user-supplied column formatters. No algorithms are introduced, no additional files are touched, and the change mirrors logic that already exists in other writer classes. An AI system reading the bug report could easily search for where formats are handled in other formats, notice the missing call in the HTML path, and replicate it. Domain knowledge needed is minimal—just understanding that _set_col_formats() must be called. Therefore the change is simple (low complexity) and highly solvable."
astropy__astropy-13579,30,medium,60,"The change touches a single method in one file and modifies only three lines, so the code delta is small. However, it requires understanding how SlicedLowLevelWCS substitutes world-coordinate values for the axes that were removed by slicing and why a hard-coded constant (1.) leads to incorrect pixel solutions when the PC matrix couples axes. Fixing the bug involves computing the correct default world coordinates via a call to _pixel_to_world_values_all and using those instead of the placeholder. This demands moderate domain knowledge of astropy’s WCS API and slice semantics but no elaborate algorithmic work, making the overall complexity modest. An AI system could infer the need to pass realistic world values rather than a constant and replicate the patch once the bug is reproduced, but it must understand the intent of the helper routine and axis bookkeeping, so success is not trivial yet still plausible. Hence, medium difficulty and ~60 % solvability."
astropy__astropy-13977,52,hard,46,"The patch modifies a single method in one file, but the change spans ~50 lines and introduces nuanced control flow around numpy’s __array_ufunc__ protocol. It wraps existing logic in a try/except, analyses the *array_ufunc* implementations of every input/output, conditionally returns NotImplemented or re-raises, and still preserves all original behavior for the successful path. Achieving this fix requires solid understanding of numpy’s ufunc dispatch rules, astropy’s Quantity unit-handling, and how Python’s binary operator fall-back works. No algorithmic heavy-lifting is added, but the semantic subtlety and need for deep domain knowledge make it more than a straightforward bug-fix. An AI without intimate knowledge of numpy’s duck-typing intricacies would find it challenging to infer the correct error-handling and compatibility checks, so solvability is below 50%, though not impossible with strong guidance."
astropy__astropy-14096,30,medium,80,"The patch touches a single method in one file and changes just a few lines, so the raw code change is small. However, it requires understanding the subtle difference between __getattr__ and __getattribute__, how Python’s attribute-resolution order interacts with properties, and why re-raising an AttributeError inside __getattr__ can mask the original missing attribute. That nuance elevates it slightly above a trivial typo fix, but the overall fix is straightforward once the cause is understood. Because the symptom and minimal reproduction are clearly described in the problem statement, and the remedy is a well-known pattern (delegate to __getattribute__ to surface the correct exception), an automated system with knowledge of Python’s data-model quirks has a good chance of proposing the same solution. Hence the task is moderate in complexity and highly solvable."
astropy__astropy-14182,35,medium,60,"The change touches a single file and adds roughly twenty lines, extending the existing fixed-width RST writer/reader to honor the generic `header_rows` option already implemented for other formats. No new algorithms are introduced, but the developer must understand how the table writer builds header, border, and data lines and how the reader skips the correct number of header lines. Adjusting `start_line`, choosing the right border line index, and threading `header_rows` through the constructor require familiarity with the internal abstractions yet remain straightforward once the design is understood. For an AI system, discovering where to pass the parameter and updating the offsets is achievable but not trivial—one must read surrounding code and reason about indexing—so solvability is moderate rather than high."
astropy__astropy-14309,15,easy,85,"The change touches a single function in one file, modifying only a handful of lines to avoid an IndexError. The bug is straightforward: `args[0]` was accessed when `args` could be empty. The fix returns the result of a filename-extension check directly, bypassing the faulty access. No complex algorithms or cross-module interactions are involved, so overall code complexity is low (≈15%). Any developer or automated system that reads the traceback and code can infer that the guard around `args[0]` is missing, making the problem easy. Because the failure is deterministic and the corrective logic is obvious, an AI has a high likelihood (≈85%) of generating the correct patch."
astropy__astropy-14365,15,easy,88,"The change touches a single file with only two small edits: adding the re.IGNORECASE flag to a compiled regular expression and comparing strings in a case-insensitive fashion by converting to upper case. No new algorithms, data structures, or cross-module interactions are introduced. The problem statement clearly pinpoints the bug (case sensitivity) and even gives an example that fails, making the required fix obvious. Locating the regex compilation and the literal 'NO' check in the code requires minimal exploration of the module. An AI system with basic understanding of Python regex and string comparison could infer these edits directly from the description, so the task is highly solvable. Overall, the fix is a straightforward, low-complexity bug patch."
astropy__astropy-14369,35,medium,55,"The change affects the unit–parsing grammar for CDS-formatted unit strings. Only two files are modified, and the functional change is limited to replacing one grammar production plus regenerating the parser table. No new algorithms or large-scale refactoring is involved, keeping code churn and architectural impact modest (≈35% complexity).

To discover the bug one must understand how left- vs. right-associative division changes the resulting unit object. Fixing it requires reading the current PLY grammar, spotting the incorrect production, and rewriting it so that division becomes left-associative. This demands some familiarity with parser generators and Astropy’s unit system but does not require deep algorithmic work, so the task is deemed “medium”.

Given the explicit bug description, a concrete failing example, and the fact that the solution is essentially a one-line grammar tweak, an AI system has a reasonable chance of producing the correct fix, though it must know to regenerate—or hand-edit—the parse table as well. Because this subtle parser detail and the need to update the generated file may trip up automated approaches, solvability is estimated at about 55%."
astropy__astropy-14508,20,easy,80,"Only a single helper function in one file is modified (~10 LOC). The change replaces an f-string with Python’s default str() representation, converts the exponent to upper-case, and keeps existing logic that trims the string to 20 characters. No new algorithm or cross-module impact. The domain nuance (FITS card length limit of 20 characters for the value field) is described explicitly in the problem statement, so an AI can infer the need to shorten the representation and keep the decimal/exponent intact. Given the clear bug description, isolated location, and straightforward string manipulation, generating this patch is highly feasible. Complexity is low because there are no structural or algorithmic challenges, only minor logic adjustments."
astropy__astropy-14539,15,easy,80,"The fix consists of a one-line change in a single file: extending an existing condition that detected variable-length array columns from only the 32-bit pointer designator (""P"") to also include the 64-bit designator (""Q"").  No new algorithms or structural changes are introduced, and the adjustment is purely additive.  While some FITS domain knowledge is helpful (knowing that both ""P"" and ""Q"" represent VLAs), the change is almost a direct pattern substitution once the bug is understood.  Therefore the technical complexity is low and the task falls in the “easy” category.  Given the clear symptom in the problem statement (difference arises with a ‘QD’ column) and the small, localized nature of the required code change, an automated system that scans for similar conditions could reasonably infer the missing case, leading to a high likelihood of successful patch generation."
astropy__astropy-14598,35,medium,60,"Only a single file is touched and the diff is just three lines, so the code change itself is small.  However, the bug lives in FITS-header parsing logic: it involves regular-expression matching of a keyword/value/comment field and the special FITS escape rule that a literal quote is represented as a doubled quote inside a string.  Fixing the bug requires (1) realising that blindly replacing ""''"" with ""'"" corrupts the legal representation of the empty string, and (2) noticing that the regex can over-match unless it is anchored to the end of the card.  That demands some domain knowledge of FITS headers and careful reasoning about edge-cases that occur only at certain character counts.  An AI supplied only with the failing example and the source could probably locate the erroneous replace() call and suspect it, but adding the regex end-anchor is less mechanical.  Overall the change is not algorithmically complex but it is more than a typo fix, so the task is moderate in complexity and moderately solvable by automated tools."
astropy__astropy-14995,12,easy,82,"The patch touches a single file and changes just one conditional branch, replacing a check for the operand object being None with a check for its mask attribute being None. This is a straightforward logic fix that does not involve new algorithms, data structures, or cross-module interactions, so the overall complexity is low. The bug is clearly described in the problem statement, including a minimal reproducible example and the exact stack trace, making it easy to identify that the issue arises when an operand exists but lacks a mask. Correcting the conditional requires only basic understanding of how the mask attribute should propagate. An AI system that parses the error message and inspects the surrounding code could plausibly infer this fix, especially given the small search space and explicit hint that v5.2 behaved correctly. Therefore, the task is classified as “easy” with a high likelihood of being solvable automatically."
astropy__astropy-7166,15,easy,85,The change touches a single file and effectively adds one logical condition: properties (data descriptors) are now treated like regular functions when inheriting docstrings. No new algorithms or architectural changes are introduced; understanding that `inspect.isdatadescriptor` identifies properties is sufficient. An AI with basic Python reflection knowledge and awareness of the bug description could infer this fix through pattern matching. Therefore the task is low-complexity and highly solvable.
astropy__astropy-7336,15,easy,85,"The bug is localized to a single conditional statement in one file. The failure is clearly described: when the return type annotation is None, a conversion method is incorrectly invoked. The required fix is to extend the existing condition so that None is treated the same as an empty annotation. This requires minimal code change (one line), no new algorithms, and only basic understanding of Python typing and the decorator’s intent. Given the clarity of the stack trace and problem statement, an AI system can reliably infer the correct adjustment, making the task highly solvable with low complexity."
astropy__astropy-7606,28,medium,82,"The patch touches a single file and changes ~10 lines, making the code alteration itself relatively small. The fix, however, relies on a correct understanding of Python’s data-model semantics: __eq__ should return NotImplemented, not False or raise, when it cannot handle the operand, so that Python can fall back to the reflected comparison or ultimately return False. Recognizing that the original code’s attempt to convert ‘other’ to a Unit object can raise TypeError and that this should be intercepted and mapped to NotImplemented requires some domain insight into both the astropy.unit API and Python operator overloading rules. Thus the task surpasses a trivial patch (simple typo/constant) but remains limited in scope and algorithmic complexity. An AI with basic knowledge of Python equality mechanics and the error trace could feasibly suggest the try/except pattern and NotImplemented return, especially since the problem statement gives a concrete failure scenario and desired behavior (“Should be False”). Hence the solvability is high but not trivial, earning an 82% estimate. Overall, the change falls into the lower end of moderate complexity."
astropy__astropy-7671,30,medium,75,"Only a single file is touched and fewer than 10 functional lines are added. The core change is adding a regex-based sanitiser that strips non-numeric qualifiers (dev, rc, etc.) from the version string before it is passed to distutils.version.LooseVersion, thereby working around a known LooseVersion comparison bug. The logic itself is straightforward and does not require deep architectural knowledge of Astropy, but it does require awareness of Python version-comparison quirks and PEP 440 semantics, which elevates the task above a trivial fix. Given the explicit failure example in the problem statement, an automated agent could reproduce the error locally and infer that normalising the version string or switching to a different parser solves the issue; several workable patches (regex strip, split on non-digits, use packaging.version) are possible, making the search space manageable. Therefore complexity is moderate, and solvability is relatively high."
astropy__astropy-8707,30,medium,85,"The patch spans two source files and adds ~40 lines, mainly to handle Python 3 byte/str distinctions. No new algorithms or data structures are introduced; the change is localized to decoding byte input and adjusting constant types. Understanding ASCII vs unicode in FITS headers and ensuring backward compatibility requires moderate domain knowledge, but the logic itself is straightforward string/bytes handling. The problem statement is explicit about the required behavior (accept both unicode and bytes, decode bytes with latin-1), so the solution space is narrow and well-defined, making it highly achievable for an automated system. Overall complexity is moderate, placing it in the 'medium' category, while the clear requirements and limited scope give it a high solvability score."
astropy__astropy-8872,35,medium,65,"The bug is localized to the dtype-selection logic in the Quantity constructor: float16 values were inadvertently routed through a branch intended for non-float types because the previous predicate relied on numpy.can_cast(np.float32, value.dtype). Fixing it merely required tightening the condition so that only integer (and later object) dtypes trigger the float promotion. The patch touches a single file and fewer than twenty lines, with no algorithmic overhaul or cross-module impact, hence moderate (≈35%) complexity. It still demands an understanding of numpy dtype kinds and of how astropy handles Quantity construction, which moves it beyond a trivial regex change and into the “medium” category. An AI system supplied with the symptom (float16 being upcast) and the surrounding code could plausibly deduce the overly broad condition and refine it, giving a better-than-even solvability likelihood (~65%). However, crafting the exact dtype checks and preserving existing integer/object coercion requires some domain reasoning, preventing a very high solvability score."
django__django-10097,20,easy,85,"The fix consists of a one-line adjustment to a regular expression in a single file. No new functions, algorithms, or cross-module interactions are introduced. The main challenge is understanding that the username/password sub-pattern should exclude the characters "":"", ""@"", and ""/"" and then translating that requirement into a negative character class in the regex. For an AI system, this is a direct mapping from the problem statement to code: replace \S with a more restrictive class ([^\s:@/]). Given the clear description of the bug and expected behavior, plus the minimal scope of the change, the task is straightforward and highly automatable. Some familiarity with regular-expression syntax is required, but no deep domain knowledge or architectural insight is needed."
django__django-10554,60,hard,30,"Although the actual diff is short and affects only two files, it touches the heart of Django’s SQL generation pipeline. Correctly handling ORDER BY clauses in the presence of UNION requires deep understanding of how the ORM maps expressions, aliases, and positional references to SQL. The fix entails detecting when an ORDER BY expression lacks a projection in the SELECT list, dynamically adding that projection, and updating positional indexes—subtle logic that must preserve all existing behaviour across databases. This demands expertise in Django internals, SQL semantics, and compiler.py conventions. An AI working solely from the high-level bug description would struggle to identify the low-level cause and craft a safe solution without extensive integration tests. Therefore the change is reasonably complex (60%) and classified as “hard”, while the likelihood that an AI could autonomously generate the correct patch from the description alone is relatively low (30%)."
django__django-10880,10,easy,90,"The bug is a straightforward string formatting issue: when both DISTINCT and a CASE expression are used in an aggregate, the generated SQL lacks a space, resulting in invalid syntax. Fixing it only requires adding a trailing space to the 'DISTINCT' keyword. The change touches a single line in one file, involves no algorithmic work, and demands only minimal familiarity with SQL and Django’s query compiler. Therefore, complexity is very low. Given the precise problem description that points directly to the missing space and the tiny, localized fix, an automated system or a developer could reliably generate the correct patch with a high probability, yielding a high solvability score."
django__django-10914,5,easy,95,"The fix is a single-line change that replaces a None default with the octal constant 0o644 in Django’s global settings. No algorithms, control flow, or multi-file interactions are involved; only a constant value is updated. The problem statement explicitly spells out the desired change (“Set default FILE_UPLOAD_PERMISSION to 0o644”), so an AI needs minimal context to generate the correct patch. Domain knowledge is limited to understanding Unix file permissions, which is straightforward. Because of the clarity and minimal scope, the task is highly solvable and sits at the very low end of complexity."
django__django-10973,35,medium,80,"The change touches one file and mainly replaces a custom temporary .pgpass-file mechanism with passing PGPASSWORD through subprocess.run’s env argument. No new algorithms are introduced; instead, existing code is simplified (about 40 lines removed, ~5 added). The required knowledge is moderate: familiarity with Python’s subprocess module, environment variable handling, PostgreSQL client behavior, and basic signal management. The problem statement clearly describes what must be done, making the desired patch easy to infer. An AI with code-transformation capability and minimal domain awareness could implement this with high likelihood, so solvability is high. However, it isn’t trivial boilerplate—understanding safety/security implications and retaining signal handling pushes it above ‘easy’, but not into genuinely ‘hard’ territory, resulting in a medium complexity rating."
django__django-10999,20,easy,70,"The change is confined to a single regular expression in one file, replacing three overlapping “-?” modifiers with a single optional sign captured at the start of the time portion. No algorithmic logic or multi-module interactions are involved; only regex syntax knowledge is needed. The problem statement clearly describes the bug, pinpoints the faulty sub-pattern, and even provides the corrected pattern, so an automated system can transform the code with straightforward text manipulation. The main challenge is recognizing how the look-ahead interacts with negative numbers, but this is a localized, well-defined issue. Therefore the task is low in complexity, falls in the 'easy' category, and is highly solvable by an AI given the explicit hint, though not completely trivial (hence 70% rather than >90%)."
django__django-11066,15,easy,85,"The patch touches a single line in one file, changing a method call by adding an existing optional argument (`using=db`). No new algorithms, data structures, or cross-module interactions are introduced. Although it requires awareness of Django’s multi-database API, that knowledge is common for anyone familiar with the framework and can also be inferred from the problem description that explicitly names the fix. Therefore the change is simple and localized (low complexity). Because the desired modification is clearly stated and has only one obvious correct form, an automated system or pattern-matching AI has a high chance of generating the correct solution (high solvability)."
